{
    "board_name": "5A-75B:V8.0",
    "board_type": "5A-75B v8.0",
    "clock_frequency": 40000000,
    "connection": {
        "connection_type": "etherbone",
        "tx_delay": 0,
        "ip_address": "10.0.0.10",
        "mac_address": "0x10e2d5000000"
    },
    "watchdog": {
        "pin": "j1:8"
    },
    "modules": [
        {
            "module_type": "gpio",
            "instances": [
                { "direction": "out", "pin": "j1:9", "name": "B" },
                { "direction": "out", "pin": "j1:10", "name": "C" },
                { "direction": "out", "pin": "j1:11", "name": "D" },
                { "direction": "out", "pin": "j1:12", "name": "CLK" },
                { "direction": "out", "pin": "j1:13", "name": "STB" },
                { "direction": "out", "pin": "j1:14", "name": "OE" },
                { "direction": "in", "pin": "j1:0", "name": "J1:R0" },
                { "direction": "in", "pin": "j1:1", "name": "J1:G0" },
                { "direction": "in", "pin": "j1:2", "name": "J1:B0" },
                { "direction": "in", "pin": "j1:4", "name": "J1:R1" },
                { "direction": "in", "pin": "j1:5", "name": "J1:G1" },
                { "direction": "in", "pin": "j1:6", "name": "J1:B1" },
                { "direction": "in", "pin": "j2:0", "name": "J2:R0" },
                { "direction": "in", "pin": "j2:1", "name": "J2:G0" },
                { "direction": "in", "pin": "j2:2", "name": "J2:B0" },
                { "direction": "in", "pin": "j2:4", "name": "J2:R1" },
                { "direction": "in", "pin": "j2:5", "name": "J2:G1" },
                { "direction": "in", "pin": "j2:6", "name": "J2:B1" },
                { "direction": "out", "pin": "j5:0", "name": "J5:R0" },
                { "direction": "out", "pin": "j5:1", "name": "J5:G0" },
                { "direction": "out", "pin": "j5:2", "name": "J5:B0" },
                { "direction": "out", "pin": "j5:4", "name": "J5:R1" },
                { "direction": "out", "pin": "j5:5", "name": "J5:G1" },
                { "direction": "out", "pin": "j5:6", "name": "J5:B1" }
            ]
        },
        {
            "module_type": "pwm",
            "instances": [
                { "pin": "j6:0", "name": "J6:R0" },
                { "pin": "j6:1", "name": "J6:G0" },
                { "pin": "j6:2", "name": "J6:B0" },
                { "pin": "j6:4", "name": "J6:R1" },
                { "pin": "j6:5", "name": "J6:G1" },
                { "pin": "j6:6", "name": "J6:B1" }
            ]
        },
        {
            "module_type": "encoder",
            "instances": [
                { "pin_A": "j3:0", "pin_B": "j3:1" },
                { "pin_A": "j3:2", "pin_B": "j3:4" },
                { "pin_A": "j3:5", "pin_B": "j3:6" },
                { "pin_A": "j4:0", "pin_B": "j4:1" },
                { "pin_A": "j4:2", "pin_B": "j4:4" },
                { "pin_A": "j4:5", "pin_B": "j4:6" }
            ]
        },
        {
            "module_type": "stepgen",
            "instances": [
                {
                    "pins": {
                        "stepgen_type": "step_dir",
                        "step_pin": "j7:0",
                        "dir_pin": "j7:1"
                    },
                    "soft_stop": true
                },
                {
                    "pins": {
                        "stepgen_type": "step_dir",
                        "step_pin": "j7:2",
                        "dir_pin": "j7:4"
                    },
                    "soft_stop": true
                },
                {
                    "pins": {
                        "stepgen_type": "step_dir",
                        "step_pin": "j7:5",
                        "dir_pin": "j7:6"
                    },
                    "soft_stop": true
                },
                {
                    "pins": {
                        "stepgen_type": "step_dir",
                        "step_pin": "j8:0",
                        "dir_pin": "j8:1"
                    },
                    "soft_stop": true
                },
                {
                    "pins": {
                        "stepgen_type": "step_dir",
                        "step_pin": "j8:2",
                        "dir_pin": "j8:4"
                    },
                    "soft_stop": true
                },
                {
                    "pins": {
                        "stepgen_type": "step_dir",
                        "step_pin": "j8:5",
                        "dir_pin": "j8:6"
                    },
                    "soft_stop": true
                }
            ]
        }
    ]
}
