{
    "board_name": "5A-75E:v7.1",
    "board_type": "5A-75E v7.1",
    "clock_frequency": 40000000,
    "connection": {
        "connection_type": "etherbone",
        "tx_delay": 0,
        "ip_address": "10.0.0.10",
        "mac_address": "0x10e2d5000000"
    },
    "watchdog": {
        "pin": "j3:6"
    },
    "modules": [
        {
            "module_type": "gpio",
            "instances": [
                { "direction": "in", "pin": "j16:0", "name": "J16:R0" },
                { "direction": "in", "pin": "j16:1", "name": "J16:G0" },
                { "direction": "in", "pin": "j16:2", "name": "J16:B0" },
                { "direction": "in", "pin": "j16:4", "name": "J16:R1" },
                { "direction": "in", "pin": "j16:5", "name": "J16:G1" },
                { "direction": "in", "pin": "j16:6", "name": "J16:B1" },
                { "direction": "in", "pin": "j15:0", "name": "J15:R0" },
                { "direction": "in", "pin": "j15:1", "name": "J15:G0" },
                { "direction": "in", "pin": "j15:2", "name": "J15:B0" },
                { "direction": "in", "pin": "j15:4", "name": "J15:R1" },
                { "direction": "in", "pin": "j15:5", "name": "J15:G1" },
                { "direction": "in", "pin": "j15:6", "name": "J15:B1" },
                { "direction": "in", "pin": "j14:0", "name": "J14:R0" },
                { "direction": "in", "pin": "j14:1", "name": "J14:G0" },
                { "direction": "in", "pin": "j14:2", "name": "J14:B0" },
                { "direction": "in", "pin": "j14:4", "name": "J14:R1" },
                { "direction": "in", "pin": "j14:5", "name": "J14:G1" },
                { "direction": "in", "pin": "j14:6", "name": "J14:B1" },
                { "direction": "in", "pin": "j13:0", "name": "J13:R0" },
                { "direction": "in", "pin": "j13:1", "name": "J13:G0" },
                { "direction": "in", "pin": "j13:2", "name": "J13:B0" },
                { "direction": "in", "pin": "j13:4", "name": "J13:R1" },
                { "direction": "in", "pin": "j13:5", "name": "J13:G1" },
                { "direction": "in", "pin": "j13:6", "name": "J13:B1" },
                { "direction": "in", "pin": "j4:0", "name": "J4:R0" },
                { "direction": "in", "pin": "j4:1", "name": "J4:G0" },
                { "direction": "in", "pin": "j4:2", "name": "J4:B0" },
                { "direction": "in", "pin": "j4:4", "name": "J4:R1" },
                { "direction": "out", "pin": "j1:7", "name": "E" },
                { "direction": "out", "pin": "j1:8", "name": "A" },
                { "direction": "out", "pin": "j1:9", "name": "B" },
                { "direction": "out", "pin": "j1:10", "name": "C" },
                { "direction": "out", "pin": "j1:11", "name": "D" },
                { "direction": "out", "pin": "j1:12", "name": "CLK" },
                { "direction": "out", "pin": "j1:13", "name": "STB" },
                { "direction": "out", "pin": "j1:14", "name": "OE" },
                { "direction": "out", "pin": "j1:0", "name": "J1:R0" },
                { "direction": "out", "pin": "j1:1", "name": "J1:G0" },
                { "direction": "out", "pin": "j1:2", "name": "J1:B0" },
                { "direction": "out", "pin": "j1:4", "name": "J1:R1" },
                { "direction": "out", "pin": "j1:5", "name": "J1:G1" },
                { "direction": "out", "pin": "j1:6", "name": "J1:B1" },
                { "direction": "out", "pin": "j2:0", "name": "J2:R0" },
                { "direction": "out", "pin": "j2:1", "name": "J2:G0" },
                { "direction": "out", "pin": "j2:2", "name": "J2:B0" },
                { "direction": "out", "pin": "j2:4", "name": "J2:R1" },
                { "direction": "out", "pin": "j2:5", "name": "J2:G1" },
                { "direction": "out", "pin": "j2:6", "name": "J2:B1" },
                { "direction": "out", "pin": "j3:0", "name": "J3:R0" },
                { "direction": "out", "pin": "j3:1", "name": "J3:G0" },
                { "direction": "out", "pin": "j3:2", "name": "J3:B0" },
                { "direction": "out", "pin": "j3:4", "name": "J3:R1" },
                { "direction": "out", "pin": "j3:5", "name": "J3:G1" },
                { "direction": "out", "pin": "j4:5", "name": "J4:G1" },
                { "direction": "out", "pin": "j4:6", "name": "J4:B1" }
            ]
        },
        {
            "module_type": "encoder",
            "instances": [
                {
                    "pin_A": "j12:0",
                    "pin_B": "j12:1",
                    "pin_Z": "j12:2",
                    "name": "J12:RGB0"
                },
                {
                    "pin_A": "j12:4",
                    "pin_B": "j12:5",
                    "pin_Z": "j12:6",
                    "name": "J12:RGB1"
                },
                {
                    "pin_A": "j11:0",
                    "pin_B": "j11:1",
                    "pin_Z": "j11:2",
                    "name": "J11:RGB0"
                },
                {
                    "pin_A": "j11:4",
                    "pin_B": "j11:5",
                    "pin_Z": "j11:6",
                    "name": "J11:RGB1"
                },
                {
                    "pin_A": "j10:0",
                    "pin_B": "j10:1",
                    "pin_Z": "j10:2",
                    "name": "J10:RGB0"
                },
                {
                    "pin_A": "j10:4",
                    "pin_B": "j10:5",
                    "pin_Z": "j10:6",
                    "name": "J10:RGB1"
                }
            ]
        },
        {
            "module_type": "pwm",
            "instances": [
                { "pin": "j9:0", "name": "J9:R0" },
                { "pin": "j9:1", "name": "J9:G0" },
                { "pin": "j9:2", "name": "J9:B0" },
                { "pin": "j9:4", "name": "J9:R1" },
                { "pin": "j9:5", "name": "J9:G1" },
                { "pin": "j9:6", "name": "J9:B1" }
            ]
        },
        {
            "module_type": "stepgen",
            "instances": [
                {
                    "pins": {
                        "stepgen_type": "step_dir_differential",
                        "step_pos_pin": "j5:0",
                        "step_neg_pin": "j5:1",
                        "dir_pos_pin": "j5:2",
                        "dir_neg_pin": "j5:4"
                    },
                    "soft_stop": true
                },
                {
                    "pins": {
                        "stepgen_type": "step_dir_differential",
                        "step_pos_pin": "j5:5",
                        "step_neg_pin": "j5:6",
                        "dir_pos_pin": "j6:0",
                        "dir_neg_pin": "j6:1"
                    },
                    "soft_stop": true
                },
                {
                    "pins": {
                        "stepgen_type": "step_dir_differential",
                        "step_pos_pin": "j6:2",
                        "step_neg_pin": "j6:4",
                        "dir_pos_pin": "j6:5",
                        "dir_neg_pin": "j6:6"
                    },
                    "soft_stop": true
                },
                {
                    "pins": {
                        "stepgen_type": "step_dir_differential",
                        "step_pos_pin": "j7:0",
                        "step_neg_pin": "j7:1",
                        "dir_pos_pin": "j7:2",
                        "dir_neg_pin": "j7:4"
                    },
                    "soft_stop": true
                },
                {
                    "pins": {
                        "stepgen_type": "step_dir_differential",
                        "step_pos_pin": "j7:5",
                        "step_neg_pin": "j7:6",
                        "dir_pos_pin": "j8:0",
                        "dir_neg_pin": "j8:1"
                    },
                    "soft_stop": true
                },
                {
                    "pins": {
                        "stepgen_type": "step_dir_differential",
                        "step_pos_pin": "j8:2",
                        "step_neg_pin": "j8:4",
                        "dir_pos_pin": "j8:5",
                        "dir_neg_pin": "j8:6"
                    },
                    "soft_stop": true
                }
            ]
        }
    ]
}
