{
    "board_name": "5A-75B:V7.0",
    "board_type": "5A-75B v7.0",
    "clock_frequency": 40000000,
    "connection": {
        "connection_type": "etherbone",
        "tx_delay": 0,
        "ip_address": "10.0.0.10",
        "mac_address": "0x10e2d5000000"
    },
    "watchdog": {
        "pin": "j1:8"
    },
    "modules": [
        {
            "module_type": "gpio",
            "instances": [
                { "direction": "out", "pin": "j1:9", "name": "B" },
                { "direction": "out", "pin": "j1:10", "name": "C" },
                { "direction": "out", "pin": "j1:11", "name": "D" },
                { "direction": "out", "pin": "j1:12", "name": "CLK" },
                { "direction": "out", "pin": "j1:13", "name": "STB" },
                { "direction": "out", "pin": "j1:14", "name": "OE" },
                { "direction": "in", "pin": "j1:0", "name": "J1:R0" },
                { "direction": "in", "pin": "j1:1", "name": "J1:G0" },
                { "direction": "in", "pin": "j1:2", "name": "J1:B0" },
                { "direction": "in", "pin": "j1:4", "name": "J1:R1" },
                { "direction": "in", "pin": "j1:5", "name": "J1:G1" },
                { "direction": "in", "pin": "j1:6", "name": "J1:B1" },
                { "direction": "in", "pin": "j2:0", "name": "J2:R0" },
                { "direction": "in", "pin": "j2:1", "name": "J2:G0" },
                { "direction": "in", "pin": "j2:2", "name": "J2:B0" },
                { "direction": "in", "pin": "j2:4", "name": "J2:R1" },
                { "direction": "in", "pin": "j2:5", "name": "J2:G1" },
                { "direction": "in", "pin": "j2:6", "name": "J2:B1" },
                { "direction": "in", "pin": "j3:0", "name": "J3:R0" },
                { "direction": "in", "pin": "j3:1", "name": "J3:G0" },
                { "direction": "in", "pin": "j3:2", "name": "J3:B0" },
                { "direction": "in", "pin": "j3:4", "name": "J3:R1" },
                { "direction": "in", "pin": "j3:5", "name": "J3:G1" },
                { "direction": "in", "pin": "j3:6", "name": "J3:B1" },
                { "direction": "in", "pin": "j4:0", "name": "J4:R0" },
                { "direction": "in", "pin": "j4:1", "name": "J4:G0" },
                { "direction": "in", "pin": "j4:2", "name": "J4:B0" },
                { "direction": "in", "pin": "j4:4", "name": "J4:R1" },
                { "direction": "in", "pin": "j4:5", "name": "J4:G1" },
                { "direction": "in", "pin": "j4:6", "name": "J4:B1" },
                { "direction": "out", "pin": "j5:0", "name": "J5:R0" },
                { "direction": "out", "pin": "j5:1", "name": "J5:G0" },
                { "direction": "out", "pin": "j5:2", "name": "J5:B0" },
                { "direction": "out", "pin": "j5:4", "name": "J5:R1" },
                { "direction": "out", "pin": "j5:5", "name": "J5:G1" },
                { "direction": "out", "pin": "j5:6", "name": "J5:B1" },
                { "direction": "out", "pin": "j6:0", "name": "J6:R0" },
                { "direction": "out", "pin": "j6:1", "name": "J6:G0" },
                { "direction": "out", "pin": "j6:2", "name": "J6:B0" },
                { "direction": "out", "pin": "j6:4", "name": "J6:R1" },
                { "direction": "out", "pin": "j6:5", "name": "J6:G1" },
                { "direction": "out", "pin": "j6:6", "name": "J6:B1" },
                { "direction": "out", "pin": "j7:0", "name": "J7:R0" },
                { "direction": "out", "pin": "j7:1", "name": "J7:G0" },
                { "direction": "out", "pin": "j7:2", "name": "J7:B0" },
                { "direction": "out", "pin": "j7:4", "name": "J7:R1" },
                { "direction": "out", "pin": "j7:5", "name": "J7:G1" },
                { "direction": "out", "pin": "j7:6", "name": "J7:B1" },
                { "direction": "out", "pin": "j8:0", "name": "J8:R0" },
                { "direction": "out", "pin": "j8:1", "name": "J8:G0" },
                { "direction": "out", "pin": "j8:2", "name": "J8:B0" },
                { "direction": "out", "pin": "j8:4", "name": "J8:R1" },
                { "direction": "out", "pin": "j8:5", "name": "J8:G1" },
                { "direction": "out", "pin": "j8:6", "name": "J8:B1" }
            ]
        }
    ]
}
