{
    "board_name": "5A-75E:V8.2",
    "board_type": "5A-75E v8.2",
    "clock_frequency": 40000000,
    "connection": {
        "connection_type": "etherbone",
        "tx_delay": 0,
        "ip_address": "10.0.0.10",
        "mac_address": "0x10e2d5000000"
    },
    "watchdog": {},
    "modules": [
        {
            "module_type": "pwm",
            "instances": [
                { "pin": "j1:0", "name": "J1:R0" },
                { "pin": "j1:1", "name": "J1:G0" },
                { "pin": "j1:2", "name": "J1:B0" },
                { "pin": "j1:4", "name": "J1:R1" }
            ]
        },
        {
            "module_type": "gpio",
            "instances": [
                { "direction": "out", "pin": "j1:7", "name": "E" },
                { "direction": "out", "pin": "j1:8", "name": "A" },
                { "direction": "out", "pin": "j1:9", "name": "B" },
                { "direction": "out", "pin": "j1:10", "name": "C" },
                { "direction": "out", "pin": "j1:11", "name": "D" },
                { "direction": "out", "pin": "j1:12", "name": "CLK" },
                { "direction": "out", "pin": "j1:13", "name": "STB" },
                { "direction": "out", "pin": "j1:14", "name": "OE" },
                { "direction": "out", "pin": "j1:5", "name": "J1:G1" },
                { "direction": "out", "pin": "j1:6", "name": "J1:B1" },
                { "direction": "out", "pin": "j2:0", "name": "J2:R0" },
                { "direction": "out", "pin": "j2:1", "name": "J2:G0" },
                { "direction": "out", "pin": "j2:2", "name": "J2:B0" },
                { "direction": "out", "pin": "j2:4", "name": "J2:R1" },
                { "direction": "out", "pin": "j2:5", "name": "J2:G1" },
                { "direction": "out", "pin": "j2:6", "name": "J2:B1" },
                { "direction": "out", "pin": "j3:0", "name": "J3:R0" },
                { "direction": "out", "pin": "j3:1", "name": "J3:G0" },
                { "direction": "out", "pin": "j3:2", "name": "J3:B0" },
                { "direction": "out", "pin": "j3:4", "name": "J3:R1" },
                { "direction": "out", "pin": "j3:5", "name": "J3:G1" },
                { "direction": "out", "pin": "j3:6", "name": "J3:B1" },
                { "direction": "out", "pin": "j4:0", "name": "J4:R0" },
                { "direction": "out", "pin": "j4:1", "name": "J4:G0" },
                { "direction": "out", "pin": "j4:2", "name": "J4:B0" },
                { "direction": "out", "pin": "j4:4", "name": "J4:R1" },
                { "direction": "out", "pin": "j4:5", "name": "J4:G1" },
                { "direction": "out", "pin": "j4:6", "name": "J4:B1" },
                { "direction": "out", "pin": "j5:0", "name": "J5:R0" },
                { "direction": "out", "pin": "j5:1", "name": "J5:G0" },
                { "direction": "out", "pin": "j5:2", "name": "J5:B0" },
                { "direction": "out", "pin": "j5:4", "name": "J5:R1" },
                { "direction": "out", "pin": "j5:5", "name": "J5:G1" },
                { "direction": "out", "pin": "j5:6", "name": "J5:B1" },
                { "direction": "out", "pin": "j6:0", "name": "J6:R0" },
                { "direction": "out", "pin": "j6:1", "name": "J6:G0" },
                { "direction": "out", "pin": "j6:2", "name": "J6:B0" },
                { "direction": "out", "pin": "j6:4", "name": "J6:R1" },
                { "direction": "out", "pin": "j6:5", "name": "J6:G1" },
                { "direction": "out", "pin": "j6:6", "name": "J6:B1" },
                { "direction": "out", "pin": "j7:0", "name": "J7:R0" },
                { "direction": "out", "pin": "j7:1", "name": "J7:G0" },
                { "direction": "out", "pin": "j7:2", "name": "J7:B0" },
                { "direction": "out", "pin": "j7:4", "name": "J7:R1" },
                { "direction": "out", "pin": "j7:5", "name": "J7:G1" },
                { "direction": "out", "pin": "j7:6", "name": "J7:B1" },
                { "direction": "out", "pin": "j8:0", "name": "J8:R0" },
                { "direction": "out", "pin": "j8:1", "name": "J8:G0" },
                { "direction": "out", "pin": "j8:2", "name": "J8:B0" },
                { "direction": "out", "pin": "j8:4", "name": "J8:R1" },
                { "direction": "out", "pin": "j8:5", "name": "J8:G1" },
                { "direction": "out", "pin": "j8:6", "name": "J8:B1" },
                { "direction": "out", "pin": "j9:0", "name": "J9:R0" },
                { "direction": "out", "pin": "j9:1", "name": "J9:G0" },
                { "direction": "out", "pin": "j9:2", "name": "J9:B0" },
                { "direction": "out", "pin": "j9:4", "name": "J9:R1" },
                { "direction": "out", "pin": "j9:5", "name": "J9:G1" },
                { "direction": "out", "pin": "j9:6", "name": "J9:B1" },
                { "direction": "out", "pin": "j10:0", "name": "J10:R0" },
                { "direction": "out", "pin": "j10:1", "name": "J10:G0" },
                { "direction": "out", "pin": "j10:2", "name": "J10:B0" },
                { "direction": "out", "pin": "j10:4", "name": "J10:R1" },
                { "direction": "out", "pin": "j10:5", "name": "J10:G1" },
                { "direction": "out", "pin": "j10:6", "name": "J10:B1" },
                { "direction": "out", "pin": "j11:0", "name": "J11:R0" },
                { "direction": "out", "pin": "j11:1", "name": "J11:G0" },
                { "direction": "out", "pin": "j11:2", "name": "J11:B0" },
                { "direction": "out", "pin": "j11:4", "name": "J11:R1" },
                { "direction": "out", "pin": "j11:5", "name": "J11:G1" },
                { "direction": "out", "pin": "j11:6", "name": "J11:B1" },
                { "direction": "out", "pin": "j12:0", "name": "J12:R0" },
                { "direction": "out", "pin": "j12:1", "name": "J12:G0" },
                { "direction": "out", "pin": "j12:2", "name": "J12:B0" },
                { "direction": "out", "pin": "j12:4", "name": "J12:R1" },
                { "direction": "out", "pin": "j12:5", "name": "J12:G1" },
                { "direction": "out", "pin": "j12:6", "name": "J12:B1" },
                { "direction": "out", "pin": "j13:0", "name": "J13:R0" },
                { "direction": "out", "pin": "j13:1", "name": "J13:G0" },
                { "direction": "out", "pin": "j13:2", "name": "J13:B0" },
                { "direction": "out", "pin": "j13:4", "name": "J13:R1" },
                { "direction": "out", "pin": "j13:5", "name": "J13:G1" },
                { "direction": "out", "pin": "j13:6", "name": "J13:B1" },
                { "direction": "out", "pin": "j14:0", "name": "J14:R0" },
                { "direction": "out", "pin": "j14:1", "name": "J14:G0" },
                { "direction": "out", "pin": "j14:2", "name": "J14:B0" },
                { "direction": "out", "pin": "j14:4", "name": "J14:R1" },
                { "direction": "out", "pin": "j14:5", "name": "J14:G1" },
                { "direction": "out", "pin": "j14:6", "name": "J14:B1" },
                { "direction": "out", "pin": "j15:0", "name": "J15:R0" },
                { "direction": "out", "pin": "j15:1", "name": "J15:G0" },
                { "direction": "out", "pin": "j15:2", "name": "J15:B0" },
                { "direction": "out", "pin": "j15:4", "name": "J15:R1" },
                { "direction": "out", "pin": "j15:5", "name": "J15:G1" },
                { "direction": "out", "pin": "j15:6", "name": "J15:B1" },
                { "direction": "out", "pin": "j16:0", "name": "J16:R0" },
                { "direction": "out", "pin": "j16:1", "name": "J16:G0" },
                { "direction": "out", "pin": "j16:2", "name": "J16:B0" },
                { "direction": "out", "pin": "j16:4", "name": "J16:R1" },
                { "direction": "out", "pin": "j16:5", "name": "J16:G1" },
                { "direction": "out", "pin": "j16:6", "name": "J16:B1" }
            ]
        }
    ]
}
