{
    "board_name": "5A-75B:V6.0",
    "board_type": "5A-75E v6.0",
    "clock_frequency": 40000000,
    "connection": {
        "connection_type": "etherbone",
        "tx_delay": 0,
        "ip_address": "10.0.0.10",
        "mac_address": "0x10e2d5000000"
    },
    "watchdog": {
        "pin":"j1:8"
    },
    "modules": [
        {
            "module_type": "gpio",
            "instances": [
                {"direction": "in",  "pin":"j1:0",  "name":"j1:1"},
                {"direction": "in",  "pin":"j1:1",  "name":"j1:2"},
                {"direction": "in",  "pin":"j1:2",  "name":"j1:3"},
                {"direction": "in",  "pin":"j1:4",  "name":"j1:5"},
                {"direction": "in",  "pin":"j1:5",  "name":"j1:6"},
                {"direction": "in",  "pin":"j1:6",  "name":"j1:7"},
                {"direction": "in",  "pin":"j1:7",  "name":"j1:8"},
                {"direction": "out", "pin":"j1:9" , "name":"j1:10"},
                {"direction": "out", "pin":"j1:10", "name":"j1:11"},
                {"direction": "out", "pin":"j1:11", "name":"j1:12"},
                {"direction": "out", "pin":"j1:12", "name":"j1:13"},
                {"direction": "out", "pin":"j1:13", "name":"j1:14"},
                {"direction": "out", "pin":"j1:14", "name":"j1:15"},
                {"direction": "in",  "pin":"j2:0",  "name":"j2:1"},
                {"direction": "in",  "pin":"j2:1",  "name":"j2:2"},
                {"direction": "in",  "pin":"j2:2",  "name":"j2:3"},
                {"direction": "in",  "pin":"j2:4",  "name":"j2:5"},
                {"direction": "in",  "pin":"j2:5",  "name":"j2:6"},
                {"direction": "in",  "pin":"j2:6",  "name":"j2:7"},
                {"direction": "in",  "pin":"j3:0",  "name":"j3:1"},
                {"direction": "in",  "pin":"j3:1",  "name":"j3:2"},
                {"direction": "in",  "pin":"j3:2",  "name":"j3:3"},
                {"direction": "in",  "pin":"j3:4",  "name":"j3:5"},
                {"direction": "in",  "pin":"j3:5",  "name":"j3:6"},
                {"direction": "in",  "pin":"j3:6",  "name":"j3:7"},
                {"direction": "in",  "pin":"j4:0",  "name":"j4:1"},
                {"direction": "in",  "pin":"j4:1",  "name":"j4:2"},
                {"direction": "in",  "pin":"j4:2",  "name":"j4:3"},
                {"direction": "in",  "pin":"j4:4",  "name":"j4:5"},
                {"direction": "in",  "pin":"j4:5",  "name":"j4:6"},
                {"direction": "in",  "pin":"j4:6",  "name":"j4:7"},
                {"direction": "in",  "pin":"j5:0",  "name":"j5:1"},
                {"direction": "in",  "pin":"j5:1",  "name":"j5:2"},
                {"direction": "in",  "pin":"j5:2",  "name":"j5:3"},
                {"direction": "in",  "pin":"j5:4",  "name":"j5:5"},
                {"direction": "in",  "pin":"j5:5",  "name":"j5:6"},
                {"direction": "in",  "pin":"j5:6",  "name":"j5:7"},
                {"direction": "in",  "pin":"j6:0",  "name":"j6:1"},
                {"direction": "in",  "pin":"j6:1",  "name":"j6:2"},
                {"direction": "in",  "pin":"j6:2",  "name":"j6:3"},
                {"direction": "in",  "pin":"j6:4",  "name":"j6:5"},
                {"direction": "in",  "pin":"j6:5",  "name":"j6:6"},
                {"direction": "in",  "pin":"j6:6",  "name":"j6:7"},
                {"direction": "in",  "pin":"j7:0",  "name":"j7:1"},
                {"direction": "in",  "pin":"j7:1",  "name":"j7:2"},
                {"direction": "in",  "pin":"j7:2",  "name":"j7:3"},
                {"direction": "in",  "pin":"j7:4",  "name":"j7:5"},
                {"direction": "in",  "pin":"j7:5",  "name":"j7:6"},
                {"direction": "in",  "pin":"j7:6",  "name":"j7:7"},
                {"direction": "in",  "pin":"j8:0",  "name":"j8:1"},
                {"direction": "in",  "pin":"j8:1",  "name":"j8:2"},
                {"direction": "in",  "pin":"j8:2",  "name":"j8:3"},
                {"direction": "in",  "pin":"j8:4",  "name":"j8:5"},
                {"direction": "in",  "pin":"j8:5",  "name":"j8:6"},
                {"direction": "in",  "pin":"j8:6",  "name":"j8:7"},
                {"direction": "out", "pin":"j9:0",  "name":"j9:1"},
                {"direction": "out", "pin":"j9:1",  "name":"j9:2"},
                {"direction": "out", "pin":"j9:2",  "name":"j9:3"},
                {"direction": "out", "pin":"j9:4",  "name":"j9:5"},
                {"direction": "out", "pin":"j9:5",  "name":"j9:6"},
                {"direction": "out", "pin":"j9:6",  "name":"j9:7"},
                {"direction": "out", "pin":"j10:0", "name":"j10:1"},
                {"direction": "out", "pin":"j10:1", "name":"j10:2"},
                {"direction": "out", "pin":"j10:2", "name":"j10:3"},
                {"direction": "out", "pin":"j10:4", "name":"j10:5"},
                {"direction": "out", "pin":"j10:5", "name":"j10:6"},
                {"direction": "out", "pin":"j10:6", "name":"j10:7"},
                {"direction": "out", "pin":"j11:0", "name":"j11:1"},
                {"direction": "out", "pin":"j11:1", "name":"j11:2"},
                {"direction": "out", "pin":"j11:2", "name":"j11:3"},
                {"direction": "out", "pin":"j11:4", "name":"j11:5"},
                {"direction": "out", "pin":"j11:5", "name":"j11:6"},
                {"direction": "out", "pin":"j11:6", "name":"j11:7"},
                {"direction": "out", "pin":"j12:0", "name":"j12:1"},
                {"direction": "out", "pin":"j12:1", "name":"j12:2"},
                {"direction": "out", "pin":"j12:2", "name":"j12:3"},
                {"direction": "out", "pin":"j12:4", "name":"j12:5"},
                {"direction": "out", "pin":"j12:5", "name":"j12:6"},
                {"direction": "out", "pin":"j12:6", "name":"j12:7"},
                {"direction": "out", "pin":"j13:0", "name":"j13:1"},
                {"direction": "out", "pin":"j13:1", "name":"j13:2"},
                {"direction": "out", "pin":"j13:2", "name":"j13:3"},
                {"direction": "out", "pin":"j13:4", "name":"j13:5"},
                {"direction": "out", "pin":"j13:5", "name":"j13:6"},
                {"direction": "out", "pin":"j13:6", "name":"j13:7"},
                {"direction": "out", "pin":"j14:0", "name":"j14:1"},
                {"direction": "out", "pin":"j14:1", "name":"j14:2"},
                {"direction": "out", "pin":"j14:2", "name":"j14:3"},
                {"direction": "out", "pin":"j14:4", "name":"j14:5"},
                {"direction": "out", "pin":"j14:5", "name":"j14:6"},
                {"direction": "out", "pin":"j14:6", "name":"j14:7"},
                {"direction": "out", "pin":"j15:0", "name":"j15:1"},
                {"direction": "out", "pin":"j15:1", "name":"j15:2"},
                {"direction": "out", "pin":"j15:2", "name":"j15:3"},
                {"direction": "out", "pin":"j15:4", "name":"j15:5"},
                {"direction": "out", "pin":"j15:5", "name":"j15:6"},
                {"direction": "out", "pin":"j15:6", "name":"j15:7"},
                {"direction": "out", "pin":"j16:0", "name":"j16:1"},
                {"direction": "out", "pin":"j16:1", "name":"j16:2"},
                {"direction": "out", "pin":"j16:2", "name":"j16:3"},
                {"direction": "out", "pin":"j16:4", "name":"j16:5"},
                {"direction": "out", "pin":"j16:5", "name":"j16:6"},
                {"direction": "out", "pin":"j16:6", "name":"j16:7"}
            ]
        }
    ]
}